{"$schema":"https://json-schema.org/draft/2020-12/schema","additionalProperties":false,"properties":{"character_ref":{},"config":{},"crop":{},"expression":{},"facing":{},"id":{"pattern":"^[a-z0-9]+(?:-[a-z0-9]+)*$","type":"string"},"kind":{"const":"generation-request"},"license_status":{},"model_id":{},"output_intent":{},"pose":{},"provenance":{},"schema_version":{"const":"1.0"},"seed":{},"style_ref":{},"tool_id":{}},"required":["kind","schema_version","id","character_ref","style_ref","pose","expression","crop","facing","tool_id","model_id","license_status","config","output_intent","provenance"],"title":"generation-request","type":"object"}
