{"character_ref":"boke@v001","config":{"steps":1},"crop":"full","expression":"neutral","facing":"front","id":"request-demo","kind":"generation-request","license_status":"approved","model_id":"fixture-model","output_intent":"fixture-validation","pose":"standing-neutral","provenance":{"source":"synthetic-fixture"},"schema_version":"1.0","seed":7,"style_ref":"rough-flat@v001","tool_id":"fixture-tool"}
